{
  "asset_id": "AS-RTW-RESCUE-001",
  "product_id": "PPL-RTWORK-OS-001",
  "title": "Red flags & rescue routing (in guide/checklist)",
  "job": "RESCUE",
  "format": "protocol",
  "source_path": "content/bundle-w19.md#rescue-card.md",
  "experience_mode": "functional",
  "required": true,
  "safety_relevant": true,
  "first_win_role": false,
  "tool_widgets": [],
  "notes": ""
}
