{
  "asset_id": "AS-FIX-COMMUNICATE-001",
  "product_id": "FIXTURE-PRODUCT-001",
  "title": "Script Pack - seven family conversations",
  "job": "COMMUNICATE",
  "format": "scripts",
  "source_path": "content/scripts.md",
  "experience_mode": "utility",
  "required": false,
  "safety_relevant": false,
  "first_win_role": true,
  "tool_widgets": [],
  "notes": ""
}
