{
  "asset_id": "AS-FIX-DECIDE-001",
  "product_id": "FIXTURE-PRODUCT-001",
  "title": "The Stump Decision Tree - normal vs worry triage",
  "job": "DECIDE",
  "format": "decision_tree",
  "source_path": "content/decision-tree.md",
  "experience_mode": "utility",
  "required": true,
  "safety_relevant": true,
  "first_win_role": false,
  "tool_widgets": [],
  "notes": ""
}
