{
  "asset_id": "AS-FIX-READ-001",
  "product_id": "FIXTURE-PRODUCT-001",
  "title": "The Cord Care Guide - what is happening and the one house rule",
  "job": "READ",
  "format": "guide",
  "source_path": "content/read-guide.md",
  "experience_mode": "functional",
  "required": true,
  "safety_relevant": false,
  "first_win_role": false,
  "tool_widgets": [],
  "notes": ""
}
